id1,id,SL,week,year,state,city,disctrict,cases,death,st_date,end_date,description,location,lat,lon
1,508,508,38,2015,Chandigarh,Chandigarh,,85,0,24-08-2015 00:00,,"13 Cases reported in 36th  week ending on 06th  September, further 72 more cases
reported in 39th  week ending on 27th  September 2015 from different sectors of Chandigarh. District RRT investigated the outbreak. House to house fever survey done. 09 from DPL Manimajra, 21 from PGIMER, 41 from GMSH-16 and 18 from  GMCH-32.Clustering  of  cases  observed  in  Sector-38.All  cases  treated symptomatically. Source reduction activities undertaken. Health education given",Chandigarh,30.7333148,76.7794179
2,533,533,39,2015,Chandigarh,Chandigarh,,112,0,24-08-2015 00:00,,"89 Cases reported till 39th week ending on 27th September, further 23 more cases reported  in  40th   week  ending  on  04th   October  2015  from  different  sectors  of Chandigarh. District RRT investigated the outbreak. House to house fever survey done. Clustering noted in Sec-22, Sec-24, Sec-38, Sec-41, Manimajra, Daria and Dhanas.  14  blood  samples  from  DPL  Manimajra,  35  blood  samples  from PGIMER, 47 blood samples from GMSH-16 and 16 blood samples from GMCH-
32  were  found  to  be  positive  for  positive  for  Dengue.  All  cases  treated symptomatically. Source reduction activities undertaken. Health education given",Chandigarh,30.7333148,76.7794179
3,720,720,46,2015,Chandigarh,Chandigarh,,905,0,02-09-2015 00:00,,"112 Cases reported till 40th  week ending on 04th  October 2015; further 783 more cases  reported  till  47th   week  ending  on  22nd   November  2015  from  different sectors of Chandigarh. District RRT investigated the outbreak. House to house fever   survey   done.   Clustering   noted   in   Sec-22,   Sec-24,   Sec-38,   Sec-41, Manimajra, Daria and Dhanas. 14 blood samples from DPL Manimajra, 35 blood samples from PGIMER, 47 blood samples from GMSH-16 and 16 blood samples from GMCH-32  were found  to be positive for  positive for  Dengue.  All  cases treated   symptomatically.   Source   reduction   activities   undertaken.   Health
education given",Chandigarh,30.7333148,76.7794179
4,790,790,50,2015,Chandigarh,Chandigarh,,919,0,02-09-2015 00:00,,"905 cases reported till 47th week ending on 22nd November 2015; further 14 more  cases  reported   from  different   sectors   of  Chandigarh.   District   RRT investigated the outbreak. House to house fever survey done. Clustering noted in Sec-22,  Sec-24,  Sector-25,  Sec-38,  Sec-41,  Manimajra,  Daria and  Dhanas.  16 blood samples from DPL Manimajra, 40 blood samples from PGIMER, 49 blood samples from GMSH-16 and 19 blood samples from GMCH-32 were found to be  positive  for  Dengue.  All  cases  treated  symptomatically.  Source  reduction
activities undertaken. Health education given",Chandigarh,30.7333148,76.7794179
5,396,396,35,2015,Chandigarh,Chandigarh,,13,0,24-08-2015 00:00,,"Cases  reported  from  Sector  38,  Manimajra,  District  Chandigarh.  District  RRT investigated the outbreak. House to house survey done.  13 blood samples tested positive  for  Dengue  (09  from DPL Manimajra,  03  from PGIMER  and  01  from GMCH-32).   All   cases   treated   symptomatically.   Source   reduction   activities
undertaken. Health education given.","Manimajra, Chandigarh",30.720226,76.8374945
6,511,511,39,2010,Chandigarh,Chandigarh,,10,0,04-09-2010 00:00,,"Cases  of  fever  reported  from  scattered  areas  of  UT,  Chandigarh,  of  whom  10  sera  samples tested positive for Dengue by ELISA test. All cases treated.  Fogging operation and anti-larval
activities  are  being  intensified  in  the  affected  areas.    IEC  activities  undertaken  regarding mosquito control measures.", Chandigarh,30.7333148,76.7794179
7,538,538,40,2010,Chandigarh,Chandigarh,,12,0,04-09-2010 00:00,,"Many cases of fever reported from UT, Chandigarh, of which 12 sera samples tested positive for Dengue by ELISA test. All cases treated. Fogging operation and anti-larval activities are being intensified  in  the  affected   areas.     IEC   activities  undertaken   regarding   mosquito  control
measures.", Chandigarh,30.7333148,76.7794179
8,578,578,41,2010,Chandigarh,Chandigarh,,24,0,04-09-2010 00:00,,"Many cases of fever reported from UT, Chandigarh, of which 12 sera samples tested positive for  Dengue  by ELISA test.  All  cases  treated.  Fogging  operation  and  anti-larval  activities  are being  intensified  in  the  affected  areas.   IEC activities  undertaken  regarding  mosquito  control
measures.",Chandigarh,30.7333148,76.7794179
9,641,641,43,2012,Chandigarh,Chandigarh,,579,0,03-09-2012 00:00,,"Outbreak  of  fever  reported  from  Chandigarh  city  and  surrounding  area, District  Chandigarh.  State  RRT  investigated  the  outbreak.  House  to  house survey  done.  Cases  treated  symptomatically.  From  3rd  September  to  21st October  2012,  579  serum  samples  were  collected  out  of  which  34  samples were  positive  for  Dengue  (NS1,  IgM  ELISA).  Entomological  survey  done. Anti larval operation and fogging done in the affected area. IEC done.", Chandigarh  city,30.7333148,76.7794179
10,662,662,44,2010,Chandigarh,Chandigarh,,24,0,04-09-2010 00:00,,"Cases  of  fever  reported  from  UT  Chandigarh,  of  which  19  sera  samples  tested  positive  for Dengue by ELISA test. Fogging operation and anti-larval activities are being intensified in the
affected areas.  IEC activities undertaken regarding mosquito control measures.",Chandigarh,30.7333148,76.7794179
11,724,724,47,2010,Chandigarh,Chandigarh,,25,0,04-09-2010 00:00,,"Cases  of  fever  reported  from  UT Chandigarh,  of  which  25  sera  samples  tested  positive  for Dengue by ELISA test. Fogging operation and anti-larval activities are being intensified in the affected areas.  IEC activities undertaken regarding mosquito control measures.",Chandigarh,30.7333148,76.7794179
12,733,733,47,2012,Chandigarh,Chandigarh,,1887,0,03-09-2012 00:00,,"A  total  of  579  cases  of  fever  were  reported  in  44th  week  (week  ending  4th November 2012) from Chandigarh city and surrounding area. Further 1308 cases occurred till 2nd December 2012. Out of total 1887 serum samples collected, 198 samples  were  positive  for  Dengue  (IgM  ELISA).  Vector  control  measures undertaken. IEC done.",Chandigarh city ,30.7333148,76.7794179
13,745,745,48,2010,Chandigarh,Chandigarh,,39,0,04-09-2010 00:00,,"Cases  of  fever  reported  from  UT  Chandigarh,  of  which  19  sera  samples  tested  positive  for Dengue by ELISA test. Fogging operation and anti-larval activities are being intensified in the affected areas.  IEC activities undertaken regarding mosquito control measures.",Chandigarh,30.7333148,76.7794179
14,1156,1156,33,2017,Chandigarh,Chandigarh,,33,0,08-07-2017 00:00,,"Cases reported from several urban areas (Sector 28, 8, 25, 38, 11,  Manimajra  etc).  District  RRT  investigated  the  outbreak. House to house survey done. All 33 serum samples were tested at  PGI,  GMCH,  GMCH  were  positive  for  Dengue  (IgM ELISA). All cases treated symptomatically. Source reduction activities undertaken. Health education given.","Sector 28, 8, 25, 38, 11,  Manimajra",30.712832,76.835097
15,1198,1198,35,2016,Chandigarh,Chandigarh,,17,0,29-08-2016 00:00,09-07-2016 00:00,"Cases  reported  from  sector  15  of  Chandigarh. District RRT investigated the outbreak. House to house survey done. Out of 17 Cases, 13 are NS1 Positive and 4 are IgM positive.  All cases treated symptomatically.   Source   reduction activities undertaken. Health education given.",sector  15  Chandigarh,30.7514904,76.7737117
16,1205,1205,35,2017,Chandigarh,Chandigarh,,77,0,08-07-2017 00:00,,"Cases  reported  from  Village  Manimajra,  Khuda  Ali  Sher. District RRT investigated the outbreak. House to house survey done.  All  77  cases  were  lab  confirmed.  All  cases  treated symptomatically.    Source    reduction    activities    undertaken.
Health education given.","  Manimajra,  Khuda  Ali  Sher",30.772286,76.8101038
17,1353,1353,40,2017,Chandigarh,,,294,0,08-07-2017 00:00,,"77 cases were reported from Village Manimajra, Khudda Sher in  week  35.  Cases  have  increased  to  294  till  current  week. Cases    also   reported    from   Ramdarbar,    Khhuda    Lahora, Maulijagram. District RRT investigated the outbreak. House to house survey done.  All cases treated symptomatically. Source reduction activities undertaken. Health education given."," Manimajra, Khudda Sher",30.772286,76.8101038
18,1387,1387,41,2017,Chandigarh,,,327,0,08-07-2017 00:00,,"77  cases  were  reported  from  Village  Manimajra,  Dhanas, Hallomajra, Khuda Lahora in week 35. Cases have increased to 327 in current week. All cases treated symptomatically. Source reduction activities undertaken. Health education given.","  Manimajra,  Dhanas, Hallomajra, Khuda Lahora",30.7640282,76.7537632
19,1407,1407,42,2017,Chandigarh,,,284,0,08-07-2017 00:00,,"77 Cases were reported in week 35.  284 Cases  reported  from Village    Ramdarbar11,    Manimajra,    Dadumajra,    Dhanas, Hallomajra,  Maulijagran.  All  cases  treated  symptomatically.
Source reduction activities undertaken. Health education given.","    Ramdarbar11,    Manimajra,    Dadumajra,    Dhanas, Hallomajra,  Maulijagran",30.692838,76.7888059
20,1524,1524,46,2020,Chandigarh,Chandigarh,,11,0,15-11-2020 00:00,15-11-2020 00:00,"Cases      reported      from      Manimajra, Maulijagran,     Dhanas.     District     RRT investigated    the    outbreak.    State    and District      NVBDCP      officials      were informed.   House  to  house  survey  done. All   11   serum   samples   collected   were positive  for  Dengue  (IgM  ELISA).  All cases   treated   symptomatically.   Source reduction activity and fogging done in the
affected area. Health education given.","Manimajra, Maulijagran,     Dhanas",30.6918985,76.8259612
21,1572,1572,49,2020,Chandigarh,Chandigarh,,13,0,12-07-2020 00:00,12-09-2020 00:00,"Cases      were      reported      from      Manimajra, Ramdarbar, Dhanas, Sec-30, Sec-40, Sec-26, Sec- 25, Sec-7, DMC, Maulijagran. All the cases were tested  positive  by  IgM  ELISA  and  were  treated. Intensification  of  Anti  Larval  work  was  done  in these    areas.    Anti-Adult    mosquito    measure augmentation   was   being   done.   IEC   activities regarding   dengue   prevention   measures   were being  carried  out  in  the  form  of  Mega  phone announcements,  Hand  bill  distribution  etc.  The Anti  Dengue  activities  had  been  clubbed  along with COVID-19 related IEC activities in the area.
Health education was given.","Manimajra, Ramdarbar, Dhanas, Sec-30, Sec-40, Sec-26, Sec- 25, Sec-7, DMC, Maulijagran",30.731231,76.8102465
