id1,id,SL,week,year,state,city,disctrict,cases,death,st_date,end_date,description,location,lat,lon
140,1271,1271,37,2017,karanataka,Tumkur,Tumkur,30,0,09-04-2017 00:00,,"Cases  reported  from  Village  Hosuru  Bhovi  colony,  PHC Mathighatta,  Taluk  Tumkur.  District  RRT  investigated  the outbreak.  House  to  house  survey  done.  Out  of  04  Serum samples tested at  DPHL Lab,  Tumkur; 01 found positive for Dengue  by  NS1.  All  cases  treated  symptomatically.  Health
education given.","  Hosuru  Bhovi  colony,  PHC Mathighatta,  Taluk  Tumkur",13.4675315,76.4817038
141,1174,1174,34,2017,karanataka,Udupi,Udupi,63,0,06-02-2017 00:00,,"Cases  reported  from  Village  Hanumantha,  PHC/CHC  UHC, Taluk Udupi. District RRT investigated the outbreak. House to house  survey  done.  Out  of  blood  samples  tested  at  MCVR Manipal,  49  found  positive  for  Dengue.  All  cases  treated symptomatically.   Source   reduction   activities   undertaken.
Health education given.","  Hanumantha,    UHC, Taluk Udupi",13.3610171,74.7431424
142,1390,1390,41,2018,karanataka,Chamarajanagar,Chamrajnagar,24,0,10-03-2018 00:00,,"Cases  reported  from  Village  Uppara  Street,  Chikkamole, PHC/CHC Doddamole, Taluk Haradhanahalli. District RRT investigated  the  outbreak.  House  to  house  survey  done.  2 blood  samples  collected  were  positive  for  Dengue  (IgM ELISA).  All  cases  treated  symptomatically.  Fogging  and anti-larval   measures  undertaken.  Health  education  given
about  personal  protection  measures  and  use  of  mosquito nets.","  Uppara  Street,  Chikkamole,  Doddamole, Taluk Haradhanahalli",11.8901909,76.9787076
143,1033,1033,26,2018,karanataka,Chikkamagaluru,Chikmagalur,21,0,18-06-2018 00:00,,"Cases   of   fever   reported   from   Village   Lakya   SC, Sadarahalli,          PHC/CHC          Kalasapura,          Taluk Chikkamagaluru. District RRT investigated the outbreak. House to house fever survey done. 05 serum samples sent to  SSL  Chikkamagaluru.  01  sample  was  positive  for Dengue  IgM  Elisa.  Larval  survey  and  source  reduction activities were done. Indoor fogging with 2% Pyrethrum
extract  was  done.    All  cases  treated  symptomatically. Relevant health education given."," Lakya SC, Sadarahalli,  Kalasapura, Taluk Chikkamagaluru",13.2776756,75.9342641
144,1511,1511,46,2018,karanataka,Raichur,Raichur,12,0,16-11-2018 00:00,17-11-2018 00:00,"Cases reported from urban area of LBS Nagar, Taluk  Raichur.  District  RRT  investigated  the outbreak.  House to house  survey done.  Out  of
12  blood  samples  collected  02  samples  were positive  for  Dengue  (NS1  ELISA).    All  cases treated    symptomatically.    Source    reduction activities undertaken. Health education given.","LBS Nagar, Taluk  Raichur",16.2245659,77.3588887
145,1580,1580,50,2019,karanataka,Bagalkot,Bagalkot,27,0,20-11-2019 00:00,,"Cases reported from Village Hullikeri, PHC/CHC Togunashio, Taluk  Badmi.  District  RRT  investigated  the  outbreak.   State and District NVBDCP officials were informed. House to house fever survey done. 12 blood sample collected and and sent to DPHL, Bagalkote; were positive for Dengue (IgM ELISA). All cases  treated   symptomatically.   Source   reduction  activities
undertaken. Health education given."," Hullikeri,  Togunashio, Taluk  Badmi",16.0449995,75.7310906
146,1034,1034,26,2019,karanataka,Bangalore Rural,Bangalore Rural,27,0,26-06-2019 00:00,28-06-2019 00:00,"Cases             reported             from             Village Honnagangaihnapalya,    PHC/CHC    Modalkote, Taluk Nelamangala. District RRT investigated the outbreak. House to house survey done.   1 sample was positive for Dengue (IgM ELISA). All cases treated   symptomatically.   Fogging   and   source reduction  activities undertaken.  Health  education
given."," Honnagangaihnapalya,        Modalkote, Taluk Nelamangala",13.0960163,77.3930024
147,1046,1046,27,2019,karanataka,Bangaluru,Bangalore,13,0,07-02-2019 00:00,07-04-2019 00:00,"Cases     reported     from     Village     Uttasipalya, PHC/CHC     Modalkote,     Taluk     Nelamangala. District  RRT   investigated  the  outbreak.  Cases presented  with  fever  and  rash.  01  water  sample and 01 blood serum sample collected and sent to PHI,  results  awaited.     Mosquito  breeding  was found   in   the   area.   All   cases   treated.   Health
education given.","     Uttasipalya,      Modalkote,     Taluk     Nelamangala",13.0985408,77.3917213
148,961,961,22,2019,karanataka,Belagavi,Belgaum,7,2,28-05-2019 00:00,29-05-2019 00:00,"Cases     reported     from     Village     Khilegaov, PHC/CHC Anathapur, Taluk Athani. District RRT investigated the outbreak. House to house survey done. Out of 5 blood sample collected and sent to BIMS;  2  samples  were  found  positive  Dengue (IgM ELISA). All cases treated symptomatically. Source   reduction   activities   undertaken.   Health education given.","     Khilegaov,  Anathapur, Taluk Athani",16.9190649,75.0740775
149,1218,1218,35,2019,karanataka,Belagavi,Belgaum,14,0,08-12-2019 00:00,,"Cases   reported   from   Village/PHC/CHC   Kudachi,   Taluk Raybag. District RRT investigated the outbreak. A total of 02 serum samples collected and were positive for Dengue by IgM ELISA.  All  cases  were  treated  symptomatically.  Fever  and larva survey conducted in the area, larval breeding present in
the area. Indoor fogging done. Health education given on use personal protective measures against mosquito bite.","Kudachi,   Taluk Raybag",16.624827,74.8510482
150,1280,1280,37,2019,karanataka,Belagavi,Belgaum,14,1,09-11-2019 00:00,,"Cases  reported  from  Village  Kudachi,  PHC  Kudachi,  Block Raybag. District RRT investigated the outbreak. The deceased was a 5 year 7 month old girl. Cases presented with Fever and rash. A total of 02 blood samples collected and sent to DSU Belagavi and found positive for Dengue by NS1 ELISA. All cases  were  treated  symptomatically.  Fever  and  larva  survey conducted.   Laval   breeding   found   in   the   area.   Indoor
fumigation  done.  Health  education  given  and  advised  to  use mosquito nets/ repellants. Health education given.","  Kudachi,  PHC  Kudachi,  Block Raybag",16.3119786,74.4290843
151,1395,1395,41,2019,karanataka,Belagavi,Belgaum,3,1,17-09-2019 00:00,,"Cases   reported   from   Village   Vantamuri   Colony,   PHC Vantamuri,  Block  Belagavi  District  RRT  investigated  the outbreak.  State  and  District  NVBDCP  officials  informed. Fever and larval survey conducted in the affected area. A total of 03 samples were collected and tested at DSU, Belagavi; 02 were  positive  for  Dengue  by  IgM  ELISA.  All  cases  were treated  symptomatically.  Entomological  survey  revealed  HI 38, CI 7 and BI 52.2. Larvicides applied at indoor and outdoor breeding  sites.  Health  education  given  on  protection  from
mosquito bite.","   Vantamuri   Colony,   PHC Vantamuri,  Block  Belagavi",15.8821155,74.5355293
152,943,943,21,2019,karanataka,Chikkamagaluru,Chikmagalur,45,0,05-02-2019 00:00,,"Cases   reported   from   Village   Timmanahalli,   PHC/CHC Kalasapura, Taluk Chikkamagaluru. District RRT investigated the outbreak. House to house survey done. Since the affected area has scarcity of water; water storage practices observed in the community.  Out  of 4  blood  sample  collected;  1  samples were found  positive Dengue (IgM ELISA).  All cases treated
symptomatically.   Source   reduction   activities   undertaken. Health education given.","   Timmanahalli,    Kalasapura, Taluk Chikkamagaluru",13.2768029,75.9337989
153,976,976,23,2019,karanataka,Chikkamagaluru,Chikmagalur,15,0,21-05-2019 00:00,,"Cases  reported  from  Village  Gowdanahalli,  PHC/CHC  KR Pete,  Taluk  Chikkamagaluru.  District  RRT  investigated  the outbreak. Primary treatment given to all fever cases. Relevant blood investigation were done to rule out Malaria, Dengue and Chikungunya.  IEC  regarding  Dengue  and  other  vector  born disease have been given to the community. Door to door fever survey  done.    Aedes  larva  survey  and  breeding  site  source reduction  being  done.    One  blood  samples  for  Dengue  and Chikungunya,  tested  positive  for  Dengue  by  NS1  ELISA.
Blood     smears-Negative    for     MP.     All     cases     treated symptomatically. Health education given.","  Gowdanahalli,    KR Pete,  Taluk  Chikkamagaluru",13.3248167,75.7731986
154,866,866,14,2019,karanataka,Chitradurga,Chitradurga,18,,15-03-2019 00:00,15-03-2019 00:00,"Cases    reported    from    Village    Megalahatti,    PHC/CHC Nagasamudra, Taluk Molakalmuru. District RRT investigated the outbreak. House to house survey done. 02 blood Samples collected   and   sent   to   DPHL   Chitradurga   and   01   found positive for Dengue, 6 blood smears collected, result awaited.
All cases treated symptomatically. Health education given.","    Megalahatti,     Nagasamudra, Taluk Molakalmuru",14.7174514,76.7460422
155,1519,1519,46,2019,karanataka,Chitradurga,Chitradurga,17,1,11-10-2019 00:00,11-12-2019 00:00,"Cases     reported     from     Village     Bagganadu, PHC/CHC avagondanahalli,    Block    Hiriyur. District RRT investigated the outbreak. State and District NVBDCP official were informed. House to house survey done. 2 serum samples collected and  sent to DPHL Chitradurga.  All cases treated symptomatically.   Entomological   survey   done. Source reduction activity and fogging done in the affected area. Health education given.","     Bagganadu,     Javagondanahalli,    Block    Hiriyur",14.213823,76.4083125
156,1017,1017,25,2019,karanataka,Dakshin Kannada,Dakshina Kannada,21,0,06-03-2019 00:00,,"Cases   reported   from   Village   Gorakshadandu,   PHC/CHC UPHC Jeppu, Taluk Mangalore. District RRT investigated the outbreak.  Cases  presented  with  fever,  headache,  body  ache and vomiting. All of them were positive for Dengue by card test  for  NS1  antigen.  A  total  of  16  samples  were  taken  and sent to DPHL of which 5 were positive for Dengue by ELISA.
House  to  house  fever  survey  done.  Health  education  given. Fogging was carried out in the area.","   Gorakshadandu,    UPHC Jeppu, Taluk Mangalore",12.8664596,74.8333735
157,1081,1081,29,2019,karanataka,Davanagere,Davanagere,32,0,16-07-2019 00:00,16-07-2019 00:00,"Cases reported from Village Hallekundavada, SC Doddabathi,  PHC  Davangere,  Block  Davangere. District RRT investigated the outbreak. 05 serum samples   collected   and   sent   to   DPHL   lab   for confirmation of Dengue and Chikungunya and 03 samples   found   positive   for   Dengue   by   IgM ELISA.  04  water  samples  taken,  result  awaited.
Active  case  search  done  in  the  area.  All  cases treated. Health education given."," Hallekundavada, SC Doddabathi,  PHC  Davangere,  Block  Davangere",14.4564984,75.9119495
158,1116,1116,31,2019,karanataka,Dharwad,Dharwad,10,0,30-07-2019 00:00,30-07-2019 00:00,"Cases  reported  from  Hubballi  KIMS  Campus, PHC  Medaroni,  Taluk  Hubballi.  District  RRT investigated  the  outbreak.  Cases  presented  with fever,  headache  and  vomiting.  On  survey  it  was found   that   hostel   was   surrounded   by   waste collections    serving   as    water    reservoirs   and subsequent   mosquito   breeding.   A   total   of   03 serum  samples  collected  and  sent  to  laboratory Hubballi  and  one  found  positive  for  Dengue  by NS1  Ag  and  negative  for  Rickettsial  fever  by RTPCR.    All    cases    treated    symptomatically.
Health education given.","Hubballi  KIMS  Campus, PHC  Medaroni,  Taluk  Hubballi",15.3628762,75.1324366
159,1274,1274,37,2019,karanataka,Dharwad,Dharwad,6,0,09-09-2019 00:00,13-09-2019 00:00,"Cases  reported  from  Village  Harobelavadi,  PHC Amminabhavi,   Taluk   Dharwad.   District   RRT investigated  the  outbreak.  Cases  presented  with fever,     headache,     vomiting,     myalgia     and generalized   weakness.   A  single  serum  sample was  collected  and  sent  to  KIMS  Microbiology department  and  found  positive  for  Dengue  and Chikungunya  by  IgM  ELISA.  All  cases  were treated symptomatically. Active case search done.
Larval survey done. Health education given.","  Harobelavadi,  PHC Amminabhavi,   Taluk   Dharwad",15.5385961,75.0523534
160,1013,1013,25,2019,karanataka,Hassan,Hassan,11,0,17-06-2019 00:00,18-06-2019 00:00,"Cases    reported     from    Village     Marenahalli, PHC/CHC  Gangur,  Taluk  Belur.  District  RRT investigated  the  outbreak.  4  blood  samples  were collected of which one  was positive for Dengue, result for chikungunya is awaited. Entomological survey  done.  All  cases  treated.  Health  education
given.","     Marenahalli,   Gangur,  Taluk  Belur",13.152593,75.8690038
161,977,977,23,2019,karanataka,Haveri,Haveri,65,0,31-03-2019 00:00,,"Cases    reported    from    Village    Kalalakonda,    PHC/CHC
Hattimathur,  Taluk  Savanur.  District  RRT  investigated  the outbreak.   Poor   sanitary  conditions  were   prevalent   in  the village. 6 blood samples taken for dengue testing and 2 found positive by IgM ELISA. Water stored in houses for domestic purposes  had  larval  breeding.  Fogging  done.  Fever  survey started. All cases treated. Indoor spraying done.","    Kalalakonda, Hattimathur,  Taluk  Savanur",14.956139,75.3353875
162,1038,1038,26,2019,karanataka,Haveri,Haveri,33,0,18-06-2019 00:00,,"Cases reported from Village Savasagi, PHC/CHC Belagalpet,
Taluk Hanagal. District RRT investigated the outbreak. House to house survey done.   Out of 8 blood samples collected and sent  to  KIMS;  1  sample  was  positive   for  Dengue  (IgM ELISA).   All  cases  treated  symptomatically.   Fogging  and source   reduction   activities   undertaken.   Health   education given."," Savasagi,  Belagalpet, Taluk Hanagal",14.7969254,75.1637226
163,1219,1219,35,2019,karanataka,Haveri,Haveri,63,0,07-08-2019 00:00,,"Cases reported from Belavagi, Negalur, Taluk Haveri. District RRT investigated the outbreak.   A total of 04 blood samples collected and tested at DPHL, Haveri were positive for Dengue by Ig M ELISA. It was observed the village had - poor sanitary conditions,  potential  mosquito  breeding  sites  and  water  was being stored in containers. Fever survey and larva survey done. Fogging  done  in  the  affected  area.  All  cases  were  treated
symptomatically. Health education given.","Belavagi, Negalur, Taluk Haveri",14.7997155,75.3972607
164,1220,1220,35,2019,karanataka,Haveri,Haveri,63,0,07-08-2019 00:00,,"Cases reported from Belavagi, Negalur, Taluk Haveri. District RRT investigated the outbreak.   A total of 04 blood samples collected and tested at  DPHL, Haveri were positive for Dengue by Ig M ELISA. It was observed the village had - poor sanitary conditions, potential mosquito breeding sites and water being stored in containers. Fever survey and larva survey conducted. Fogging  done  in  the  affected  area.  All  cases  were  treated
symptomatically. Health education given.","Belavagi, Negalur, Taluk Haveri",14.7997155,75.3972607
165,1115,1115,31,2019,karanataka,Chikkaballapur,Chickaballapura,8,0,27-07-2019 00:00,08-03-2019 00:00,"Cases  reported  from  Village  Gotlagunte,  PHC Nakkalahalli,  Taluk  Gowribidanur.  District  RRT investigated  the  outbreak.  Lab  samples  collected and   result   reported   as   Dengue   IgM   ELISA positive.    All    cases    treated    symptomatically.
Health education given.","  Gotlagunte,  PHC Nakkalahalli,  Taluk  Gowribidanur",13.4703994,77.5149266
166,1117,1117,31,2019,karanataka,Chikkaballapur,Chickaballapura,28,0,24-07-2019 00:00,,"Cases     reported     from    Village     Giddappanahalli,     PHC Beechaganahalli, Taluk Gudibande. District RRT investigated the outbreak.  Blood samples collected and found positive for Dengue  by  NS1  at  SSL  Chikkaballapur.  All  cases  treated
symptomatically.  Fogging  done  in  the  affected  area.  Use  of mosquito net was advocated. Health education given."," Giddappanahalli, PHC Beechaganahalli,Taluk Gudibande",13.6762111,77.700804
167,1184,1184,34,2019,karanataka,Chikkaballapur,Chickaballapura,40,1,16-08-2019 00:00,21-08-2019 00:00,"Cases       reported       from       several       villages Dodnancherlu,     Rayanakallu,     Bachapanahalli, several      Taluk      Gudibande,      Gowribidanur, Chintamani.    District    RRT    investigated    the outbreak.  House  to  house  survey done.  Out  of  4 serum samples collected; 3 samples were positive for   Dengue   (IgM   ELISA).   All   cases   treated symptomatically.   Entomological   survey   done.
Source reduction activity and fogging done in the affected area. Health education given.","s Dodnancherlu,     Rayanakallu,     Bachapanahalli, several      Taluk      Gudibande,      Gowribidanur, Chintamani",13.6762111,77.700804
168,1415,1415,42,2019,karanataka,Chikkaballapur,Chickaballapura,24,0,10-09-2019 00:00,10-09-2019 00:00,"Cases  reported  from  Village  Hale  Peresandra,  PHC/CHC Perasandra, Taluk Chikkaballapur. District RRT  investigated the  outbreak.   State  and   District  NVBDCP   officials   were informed.  House  to  house  survey  done.  2  blood  samples collected  and  sent  to  SSL;  were  found  positive  for  Dengue (IgM   ELISA).   All  cases  treated   symptomatically.   Source
reduction activities undertaken. Health education given.","  Hale  Peresandra,   Perasandra, Taluk Chikkaballapur",13.6022108,77.8002402
169,1555,1555,48,2019,karanataka,Chikkaballapur,Chickaballapura,21,0,24-11-2019 00:00,27-11-2019 00:00,"Cases     reported     from     Village     Chintamani, Murugumalla PHC, Chelamanahalli. District RRT investigated   the   outbreak.   State   and   District NVBDCP officials were informed. House to house survey done. 1 blood sample collected and sent to SSL  was  positive  for  Dengue  (IgM  ELISA).  All cases   treated   symptomatically.   Entomological survey   done.   Fogging   activity   carried   out   in affected     area.     Source     reduction     activities undertaken. Health education given.","     Chintamani, Murugumalla PHC, Chelamanahalli",13.4379435,78.1277728
170,1556,1556,48,2019,karanataka,Chikkaballapur,Chickaballapura,25,0,26-11-2019 00:00,29-11-2019 00:00,"Cases  reported  from  Village  Hale  Ganjigunte, PHC Ganjigunte. Block Sidlaghatta. District RRT investigated     the     outbreak.     District     RRT investigated   the   outbreak.   State   and   District NVBDCP officials were informed. House to house survey done. 1 blood sample collected and sent to SSL  was  positive  for  Dengue  (IgM  ELISA).  All cases   treated   symptomatically.   Entomological survey   done.   Fogging   activity   carried   out   in affected     area.     Source     reduction     activities undertaken. Health education given.","  Hale  Ganjigunte, PHC Ganjigunte. Block Sidlaghatta",13.4934202,77.9820207
171,1098,1098,30,2019,karanataka,Mandya,Mandya,19,0,22-07-2019 00:00,26-07-2019 00:00,"Cases   reported   from   Village   Shikaripura,   SC Thuppudamadu,     PHC     Haradanahalli,     Taluk Nagamangala.   District   RRT   investigated   the outbreak.  House to house survey done.  Out  of 3 serum  samples  collected;  1  sample  was  found positive  for   Dengue  (IgM   ELISA).   All   cases treated   symptomatically.   Entomological   survey done. Source reduction activity and fogging done in the affected area. Health education given.","   Shikaripura,   SC Thuppudamadu,     PHC     Haradanahalli,     Taluk Nagamangala",12.8367606,76.7265726
172,894,894,17,2019,karanataka,Raichur,Raichur,7,0,24-04-2019 00:00,26-04-2019 00:00,"Cases  reported  from  Village  Mustur,  PHC/CHC Masarakal,    Taluk    Deodurga.    District    RRT investigated the outbreak. House to house survey done. Out of 5 blood sample collected and sent to VIMS  Ballari;  2  samples  were  found  positive Dengue    (IgM    ELISA).    All    cases    treated
symptomatically.    Source    reduction    activities undertaken. Health education given.","  Mustur,   Masarakal,    Taluk    Deodurga",16.4144731,76.9307153
173,1099,1099,30,2019,karanataka,Raichur,Raichur,4,0,22-07-2019 00:00,24-07-2019 00:00,"Cases  reported  from Village/SC  Idabhavi,  PJHC Gurugunta,    Block    Lingsugur.    District    RRT investigated the outbreak. House to house survey done. Out of 4 serum samples collected; 1 sample was found positive for Dengue (IgM ELISA). All cases   treated   symptomatically.   Entomological
survey done. Source reduction activity and fogging done in the affected area. Health education given.","  Idabhavi,  PJHC Gurugunta,    Block    Lingsugur",16.2872489,76.6282747
174,1567,1567,49,2019,karanataka,Raichur,Raichur,7,0,12-02-2019 00:00,12-02-2019 00:00,"Cases reported from Village Bandi Sokapur, SC/ PHC Sajjalgudda, Block Lingsugur. District RRT investigated   the   outbreak.   State   and   District NVBDCP   officials   were   informed.   House   to house   survey  conducted.   High   vector   density, many   breeding   sites   and   poor   sanitation   and unhygienic  conditions  observed  in  the  area.  A total  of  07  blood  samples  were  collected  and tested   at   SSL   DSU,   Raichur;   01   was   found positive  for  Dengue  by  IgM  MAC  ELISA.  All cases    were    treated    symptomatically.    Source
reduction  activities  carried  out.  Fogging  done. Health education given."," Bandi Sokapur, SC/ PHC Sajjalgudda, Block Lingsugur",16.0725793,76.3116235
175,1132,1132,32,2019,karanataka,Tumkur,Tumkur,14,0,08-06-2019 00:00,08-07-2019 00:00,"Cases     reported     from     Village     Jayanagara, PHC/CHC    Badavanahalli,    Taluk    Madhugiri. District RRT investigated the outbreak. House to house fever  survey done.  Out of 2  blood  sample collected and sent to DPHL Tumkur; 1 sample was positive for Dengue and 1 sample was positive for Dengue and Chikungunya (IgM ELISA). All cases treated     symptomatically.     Source     reduction
activities undertaken. Health education given.","     Jayanagara,     Badavanahalli,    Taluk    Madhugiri",13.661285,77.21575
176,1490,1490,45,2019,karanataka,Tumkur,Tumkur,33,0,22-10-2019 00:00,,"Cases   reported   from   Village   Bupuru   Tanda,   PHC/CHC Doddahalli,  Taluk  Pavagada.  District  RRT  investigated  the outbreak.    State    and    District    NVBDCP    officials    were informed. House to house fever survey done. Larval breeding was  found  around  the  house.    A  total  of  04  blood  samples were collected and tested at DPHL, Tumkur;01  was positive for both Dengue and Chikungunya and 01 was equivocal for Chikungunya   by   IgM   ELISA.   All   cases   were   treated symptomatically.   Source   reduction   activities   undertaken. Health education given.","   Bupuru   Tanda,    Doddahalli,  Taluk  Pavagada",14.10287,77.284458
177,1521,1521,46,2019,karanataka,Tumkur,Tumkur,15,0,11-04-2019 00:00,,"Cases   reported   from   Village   Kempanahalli,   PHC/CHC Guligenahalli,   Taluk   Sira.   District   RRT   investigated   the outbreak. State and District NVBDCP official were informed. House to house survey done.  2  serum samples collected  and sent  to  DPHL  Tumukur.  All  cases  treated  symptomatically. Entomological  survey  done.  Source  reduction  activity  and
fogging done in the affected area. Health education given.","   Kempanahalli,    Guligenahalli,   Taluk   Sira",13.7108885,76.9902619
178,1558,1558,48,2019,karanataka,Tumkur,Tumkur,18,0,11-04-2019 00:00,,"Cases  reported  from  Village  Maleenahalli  Hatti,  PHC/CHC Gubbi, Taluk Gubbi. District RRT investigated the outbreak. State and District NVBDCP officials were informed. House to house survey done. 1 blood sample collected and sent to SSL was  positive  for  Dengue  (IgM  ELISA).  All  cases  treated symptomatically. Entomological survey done. Fogging activity carried   out   in   affected   area.   Source   reduction   activities undertaken. Health education given.","  Maleenahalli  Hatti,   Gubbi, Taluk Gubbi",13.308293,76.937247
179,1568,1568,49,2019,karanataka,Tumkur,Tumkur,49,1,11-06-2019 00:00,,"Cases   reported   from   Village   Madakanahalli   Gollarhatti, PHC/CHC Tavarekere, Taluk Sira. District RRT investigated the  outbreak.  State  and  District  NVBDCP  officials   were informed.  House  to  house  fever  survey  conducted.  Larval sources   identified   and   water   stagnation   observed   in   the affected area. The deceased was a 56y/M. A total of 07 blood samples  and  03  water  samples  collected  and  sent  to  DPHL, Tumkur;  01  was  found  positive  for  Dengue  by  IgM  ELISA and water samples were potable. A total of 03 water samples collected  and  tested  at  DPHL,  Tumkur;  result  awaited.  All cases were treated symptomatically. Temporary clinic setup in
the affected area. Health education given.","   Madakanahalli   Gollarhatti,  Tavarekere, Taluk Sira",13.8303581,76.9190442
180,1569,1569,49,2019,karanataka,Tumkur,Tumkur,19,0,18-11-2019 00:00,,"Cases  reported  from  Village  Shettihalli,  PHC/CHC  Byalya, Taluk  Madhugiri.  District  RRT  investigated  the  outbreak. State  and  District  NVBDCP  officials  were  informed.  Fever survey  conducted  in  the  affected  area.  A  total  of  02  blood samples collected and tested at DPHL, Tumkur; 01 was found positive  for  Dengue  and  Chikungunya  by  IgM  ELISA.  All cases    were    treated    symptomatically.    Source    reduction
activities undertaken. Fogging done. Health education given.","   Shettihalli,    Byalya, Taluk  Madhugiri",13.661285,77.21575
