id1,id,SL,week,year,state,city,disctrict,cases,death,st_date,end_date,description,location,lat,lon
91,204,204,23,2015,karanataka,Tumkur,Tumkur,12,0,25-05-2015 00:00,,"Cases    reported    from    Village    PHC    Devarahalli    Gollarahatti,    Taluk Dooddagrahara, District Tumkur. District RRT investigated the outbreak. House to  house  fever  survey  done.  02  out  of  03  blood  samples  were  found  to  be positive for Dengue IgM ELISA.  All cases treated symptomatically. Anti larval activities were under taken.Temephos was applied in water containers. Health
education given.",Devarahalli    Gollarahatti,13.5097878,76.5676071
92,214,214,24,2015,karanataka,Tumkur,Tumkur,35,0,29-05-2015 00:00,,"Cases of fever reported from Village Devarahalli, PHC Dooddagrahara Block Sira District  Tumkur.  District  RRT  investigated  the  outbreak.  House  to  house  fever survey done. 02 out 03 blood samples tested at District  Lab Tumkur were found to be positive for dengue IgM ELISA. All cases treated symptomatically. Anti larval activities were undertaken. Health education given.","Devarahalli, Dooddagrahara",13.5563196,76.8807437
93,461,461,38,2015,karanataka,Tumkur,Tumkur,23,0,10-09-2019 00:00,15-09-2015 00:00,"Cases   reported   from   Village   Reddihalli,   SC   R   Gollarahatti,
PHC/CHC Midigeshi, TalukMadhugiri. District RRT investigated the outbreak. House to house survey done. 02 blood samples sent to District Hospital Laboratory. 01 sample tested positive for dengue and 01 sample tested positive for Chikungunya. All cases treated symptomatically.  Source  reduction  activities  carried  out.  Health
education given.","Reddihalli, R   Gollarahatti",13.8412262,77.1612996
94,594,594,42,2015,karanataka,Tumkur,Tumkur,21,0,13-10-2015 00:00,16-10-2015 00:00,"Cases  of  fever  reported  from  Village  Kamberahatti,  PHC/CHC Chikkaunnala.  District  RRT  investigated  the  outbreak.  House  to house fever survey done. 02 Blood sample tested at DPHL, Tumkur
were found to be positive for Dengue and Chikungunya. All cases","Kamberahatti,  PHC/CHC Chikkaunnala",13.3399985,77.1000114
95,231,231,25,2015,karanataka,Udupi,Udupi,176,0,02-06-2015 00:00,,"Cases  reported  from two  Taluks,  namely Udupi  and  Kundapura  District  Udupi. District RRT investigated the outbreak. House to house fever survey done. Out of 176  samples  tested  at  DPL  Udupi,  50  samples  tested  positive  for  dengue  IgM ELISA.  All  cases  treated  symptomatically.  Anti  larval  activities  under  taken.
Fogging done in the area. Health education given",Kundapura ,13.6235274,74.6917418
96,836,836,5,2016,karanataka,Belgaum,Belgaum,5,0,02-03-2016 00:00,02-05-2016 00:00,"Cases    reported    from    Village    Jothi    Nagar, PHC/CHC Belagundi.  District RRT investigated the outbreak. House to house survey done. Out of 05 Blood samples tested at BIMS; 01 Sample was found   to  be  positive   for  NS1   IgM   Elisa  for Dengue.    All   cases   treated    symptomatically. Source  reduction  activities  undertaken.  Health
education given.","    Jothi    Nagar,  Belagundi",15.8752098,74.5379371
97,1475,1475,45,2016,karanataka,Davanagere,Davanagere,50,0,11-08-2016 00:00,11-11-2016 00:00,"Cases  reported  from  Village  Belimallur,  PHC Govinakovi,   Taluka   Honnalli.   District   RRT investigated the outbreak. House to house survey done.  Out  of 08  Blood  samples  tested  at  SSL, Davangere,   05   samples   found   positive   for Chikungunya and 01 sample found positive for Dengue    by    IgM    Elisa    All    cases    treated
symptomatically. Health education given.","  Belimallur,  PHC Govinakovi,   Taluka   Honnalli",14.165367,75.6680832
98,888,888,17,2016,karanataka,Dharwad,Dharwad,15,0,30-04-2016 00:00,30-04-2016 00:00,"Cases reported from Village/PHC/CHC Uppin
Betageri,    Taluk    Dharwad.    District    RRT investigated   the  outbreak.   House  to   house survey done. Out of 03 Serum samples tested at  KIMS,  Hubli;  1  was  found  positive  for Dengue    IgM    ELISA.    All    cases    treated
symptomatically.  Source  reduction  activities undertaken. Health education given.","illage/CHC Uppin
Betageri,    Taluk    Dharwad",15.4580436,75.0132912
99,1002,1002,25,2016,karanataka,Gadag,Gadag,12,0,22-06-2016 00:00,25-06-2016 00:00,"Cases   reported   from   Village   Kabalayathkatti Tanda,  PHC/CHC  Nagavi,  Taluk  Gadag.  District RRT  investigated  the  outbreak.  House  to  house survey done.     02  Serum samples  tested  at  SSL, Gadag were positive for Dengue by IgM ELISA. All    cases     treated    symptomatically.     Health
education given.","   Kabalayathkatti Tanda,    Nagavi,  Taluk  Gadag",15.361365,75.6084367
100,1088,1088,30,2016,karanataka,Gadag,Gadag,12,0,22-07-2016 00:00,26-07-2016 00:00,"Cases   reported   from   Village   Kabalayathkatti tanda,  SC  Beladadi,  PHC  Nagavi.  District  RRT investigated the outbreak. House to house survey done.  Out  of  02  serum  samples  tested  at  KMC Hubli,  01  found  positive  for  Dengue  IgM  Elisa test.  All  cases  treated  symptomatically.  Source reduction activities undertaken. Health education given.","   Kabalayathkatti tanda,  SC  Beladadi,  PHC  Nagavi",15.361365,75.6084367
101,918,918,20,2016,karanataka,Hassan,Hassan,12,0,17-05-2016 00:00,19-05-2016 00:00,"Cases   reported   from   Village   Gundenahalli,
PHC/CHC H.H. Kavalu, Taluk Hassan. District RRT investigated the outbreak. House to house survey done. 3 serum samples collected and sent to SSL,  Hassan.  All  were positive for Dengue by  NS1  antigen.  Entomological  surveillance done (HI 3.5, CI 1.6 & BI 3.5). All cases treated
symptomatically.   Source   reduction   activities undertaken. Health education given.","   Gundenahalli,  H.H. Kavalu, Taluk Hassan",14.7437063,75.471613
102,1232,1232,36,2016,karanataka,Kolar,Kolar,23,0,09-07-2016 00:00,09-08-2016 00:00,"Cases     reported     from     Village     Chillappanahalli, PHC/CHC     Holur,     Taluk     Kolar.     District     RRT investigated the outbreak. House to house survey done. Out of 06 Blood samples tested, 01   found positive for
dengue.   All   cases   treated   symptomatically.   Source reduction activities undertaken. Health education given.","     Chillappanahalli,      Holur,     Taluk     Kolar",13.2473876,78.2130785
103,1260,1260,37,2016,karanataka,Chikkaballapur,Chickaballapura,23,0,09-04-2016 00:00,,"Cases reported from Village Irgapanahalli, PHC/CHC Sadali, Taluk Sidlaghatta. District RRT investigated the outbreak. House to house survey done. Out of 02 Blood samples tested at DSL, one each was positive    for    Dengue    and    Chikungunya.    All    cases    treated symptomatically. Health education given."," Irgapanahalli,  Sadali, Taluk Sidlaghatta",13.3941904,77.8639872
104,1167,1167,34,2016,karanataka,Mandya,Mandya,28,0,15-08-2016 00:00,,"Cases  reported  from  Village  Gollarahalli,  PHC  Kothipura, Taluk   Maddur.   District   RRT   investigated   the   outbreak. House to house survey done. Out of 04 blood samples tested, 02 samples found positive for IgM dengue. Out  of 6  Water samples   tested.   03   samples   found   non   potable.   Source reduction activities done. All cases treated symptomatically.
Health education given.","  Gollarahalli,  PHC  Kothipura, Taluk   Maddur",12.5866972,77.0453429
105,1202,1202,35,2016,karanataka,Mandya,Mandya,28,0,15-08-2016 00:00,,"Cases  reported  from  Village  Gollarahalli,  PHC  Kothipura, Taluk  Maddur.   District  RRT   investigated   the  outbreak. House to house survey done. Out of 04 Blood samples tested at  District  Lab;     02  found  positive  for  dengue.  All  cases treated    symptomatically.    Source    reduction    activities undertaken. Health education given.","  Gollarahalli,  PHC  Kothipura, Taluk  Maddur",12.5861699,77.043719
106,967,967,23,2016,karanataka,Shimoga,Shimoga,14,0,06-09-2016 00:00,06-09-2016 00:00,"Cases     reported     from     Village     Kethavalli, PHC/CHC   Jade,   Taluk   Soraba.   District   RRT investigated the outbreak. House to house survey done.Out  of  06  Blood  samples  tested  at  VDL Shimoga;  2  were  positive  for  Dengue  by  IgM ELISA. All cases treated symptomatically. Source reduction activities undertaken. Health education
given."," Kethavalli,    Jade, Taluk Soraba",14.3137113,75.043332
107,1003,1003,25,2016,karanataka,Tumkur,Tumkur,49,1,16-06-2016 00:00,21-06-2016 00:00,"Cases    reported    from    Village    Devang    Bidi,
PHC/CHC/Taluk     CN     Halli.     District     RRT investigated the outbreak. House to house survey done.    Out of 05 Blood samples tested at District Hospital   Lab,   Tumkur,   03   were   positive   for dengue     IgM     ELISA.     All     cases     treated symptomatically.    Source    reduction    activities undertaken. Health education given.","    Devang    Bidi,
/Taluk     CN     Halli",13.337187,77.0971536
108,1284,1284,38,2016,karanataka,Tumkur,Tumkur,21,0,14-09-2016 00:00,20-09-2016 00:00,"Cases reported from Village Dasarammanahalli, PHC/CHC Thirumani/Pallipalli, Taluk Pavagad. District RRT investigated the outbreak. House to house  survey  done.  Out  of  04  blood  samples tested at SSL, tumkur, 02 samples found positive for  dengue  and  Chikungunya  both,  01  sample positive for dengue and  other 01  sample found positive for Chikungunya only by IgM Elisa. All cases treated symptomatically. Health education
given."," Dasarammanahalli,  Thirumani/Pallipalli, Taluk Pavagad",13.3257244,77.119348
109,1425,1425,43,2016,karanataka,Tumkur,Tumkur,25,0,17-10-2016 00:00,,"Cases  reported  from  Village  Gollarahatti,  PHC/CHC  Santhe mavatturu,  Taluk  Kunigal.     District  RRT  investigated  the outbreak. House to house survey done. Out of 04 Blood samples tested  at  SSL  Tumkur  ,  1  was  positive  for  Dengue  by  IgM ELISA  and  2  with  NS1.  All  cases  treated  symptomatically.
Health education given.","  Gollarahatti,    Santhe mavatturu,  Taluk  Kunigal",13.0228713,77.0204279
110,55,55,11,2016,karanataka,Udupi,Udupi,7,0,12-03-2016 00:00,,"Cases   reported   from   Village   Shedimane,   PHC/CHC   Belve, Taluk Kundapur. District RRT investigated the outbreak. House to house survey done.  07 Blood,  03 Samples found positive by IgM  ELISA  and  result  awaited  for  remaining  04  Samples.  All cases   treated   symptomatically.   Source   reduction   activities
undertaken. Health education given.","Shedimane,Belve",13.5279848,74.9227021
111,966,966,23,2016,karanataka,Udupi,Udupi,20,0,06-05-2016 00:00,06-09-2016 00:00,"Cases reported from Village Mooduru, PHC/CHC Kolluru,     Taluk     Kundapur.     District     RRT investigated the outbreak. House to house survey done. Out of 11 Samples tested at DPHL Udupi; 8 were  positive  for  Dengue  by  NS1  ELISA.  All cases  treated  symptomatically.  Source  reduction
activities undertaken. Health education given."," Mooduru,  Kolluru, Taluk Kundapur",13.6364479,74.689248
112,968,968,23,2016,karanataka,Udupi,Udupi,13,0,28-05-2016 00:00,,"Cases  reported  from  Village/PHC/CHC  Idu,  Taluk  Karkala. District RRT investigated the outbreak. House to house survey done.  07  Serum samples  collected;  Result,  04  Samples  found Dengue NS1ELISA positive and 3 were positive by IgM ELISA. All  cases  treated  symptomatically.  Source  reduction  activities
undertaken. Health education given.","/CHC  Idu,  Taluk  Karkala",13.1869852,74.9385917
113,1168,1168,34,2016,karanataka,Udupi,Udupi,13,0,08-12-2016 00:00,,"Cases reported from Village Kodavoor A, PHC Malpe, Taluk Udupi.  District  RRT  investigated  the  outbreak.  House  to house survey done. Out of 10 blood samples tested at DPH, 02  samples  found  positive  for dengue  by both  IgM ELISA and NS1 ELISA.  All  cases treated symptomatically.  Source
reduction activities done. Health education given."," Kodavoor A, PHC Malpe, Taluk Udupi",13.350534,74.704399
114,1563,1563,49,2016,karanataka,Udupi,Udupi,16,0,12-03-2016 00:00,12-09-2016 00:00,"Cases reported from Village Kodankuru ward, PHC/CHC Urban Health Center, Taluk Udupi. District    RRT    investigated    the    outbreak, HI=68%  and  CI=41.17%.   House  to  house survey done. Out of 08 Serum samples tested, 3 tested positive for dengue, DPHL Udupi. All cases     treated     symptomatically.     Source reduction     activities     undertaken.     Health
education given."," Kodankuru ward,  Urban Health Center, Taluk Udupi",13.3408807,74.7421427
115,908,908,19,2016,karanataka,Uttara Kannada,Uttara Kannada,10,0,13-05-2016 00:00,13-05-2016 00:00,"Cases     reported    from    VillageS    hirwad,
PHC/CHC   Siddar,   Taluk   Karwar.   District RRT   investigated   the   outbreak.   House   to house survey done. Out of 02 serum samples tested  at  SSL,  Karwar;  1  was  positive  for Dengue  by  IgM  ELISA.  All  cases  treated symptomatically. Health education given.","S    hirwad,    Siddar,   Taluk   Karwar",14.8115742,74.1623121
116,876,876,16,2017,karanataka,Bagalkot,Bagalkot,20,0,17-04-2017 00:00,18-04-2017 00:00,"Cases    reported    from    Village    Kutakankeri, PHC/CHC      Nandikeshwar.      District      RRT investigated the outbreak. House to house survey done.  Out  of  07  Serum  samples  tested,  3  found positive for Dengue IgM at DSU Bagalkot; all 20 PBS found negative for malaria. All cases treated symptomatically.    Source    reduction    activities
undertaken. Health education given.","    Kutakankeri,       Nandikeshwar",15.9440305,75.7592717
117,933,933,21,2017,karanataka,Chitradurga,Chitradurga,17,0,23-05-2017 00:00,24-05-2017 00:00,"Cases  reported  from  Village  Sordarnal,  Taluk Hosadurga, PHC/CHC Madadakere. District RRT investigated the outbreak. House to house survey done.  Out  of  02  serum  collected  and  sent  to DPHL,  Chitradurga,  1  sample  was  positive  for Dengue.   Entomological   survey   showed   larval indices  BI  1.5%,  CI  2%,  HI  11%.  All  cases
treated symptomatically. Health education given.","  Sordarnal,  Taluk Hosadurga,  Madadakere",13.796377,76.2920961
118,1105,1105,31,2017,karanataka,Chitradurga,Chitradurga,23,0,08-03-2017 00:00,08-03-2017 00:00,"Cases  reported  from  Village  Chenaiahanahatti, PHC/CHC Kysapura, Taluk Chitradurga. District RRT  investigated  the  outbreak.  House  to  house survey  done.  Out  of  02  blood  samples  tested  at District Public Health Lab, Chitradurga, 01 found positive     for     Dengue.     All     cases     treated symptomatically.    Source    reduction    activities undertaken. Health education given.","  Chenaiahanahatti,  Kysapura, Taluk Chitradurga",14.213823,76.4083125
119,954,954,22,2017,karanataka,Davanagere,Davanagere,28,0,25-05-2017 00:00,30-05-2017 00:00,"Cases    reported    from    Village    Jigali,    PHC
Holesirgere,    Taluk    Harihara.    District    RRT investigated the outbreak. House to house survey done.  All  06  Serum  samples  tested  positive  for Dengue  and  out  of  04  Water  samples  tested,  3 were   found   non   potable.   All   cases   treated symptomatically.    Source    reduction    activities
undertaken. Health education given.","    Jigali,    PHC
Holesirgere,    Taluk    Harihara",14.4391353,75.7092627
120,891,891,17,2017,karanataka,Davanagere,Davanagere,26,0,17-04-2017 00:00,,"Cases   reported   from   Village   Lakkampur   Village,   PHC
Basawankotte,  Taluk  Jagalur.  District  RRT  investigated  the outbreak. All 4 Serum samples tested at DSL Davangere were found to be positive for Dengue by IgM Elisa. All cases treated symptomatically.   Health   education   given   on   safe   drinking
water.","   Lakkampur   ,   PHC
Basawankotte,  Taluk  Jagalur",14.5195377,76.3373135
121,988,988,24,2017,karanataka,Kalaburagi,Gulbarga,23,0,17-06-2017 00:00,18-06-2017 00:00,"Cases reported from Village Bharatnur, PHC/CHC Mangalgi,     Taluk     Chittapur.     District     RRT investigated the outbreak. House to house survey done.   Out of 10 blood samples tested, 01 found positive  for  Dengue  &  Chikungunya  by  IgM ELISA  at  SSL  Gulbarga.  All  14 Samples  tested For  Malaria  by  RDT  Method  found  negative. HI=20%,   CI=21.42%  and   BI=48%.   All   cases
treated     symptomatically.     Source     reduction activities undertaken. Health education given."," Bharatnur,  Mangalgi, Taluk Chittapur",17.3496382,77.1765548
122,1069,1069,29,2017,karanataka,Kalaburagi,Gulbarga,24,0,19-07-2017 00:00,20-07-2017 00:00,"Cases   reported   from   Village   Nay   Mohalla, PHC/CHC  Khanapur,  Taluk  Kalburagi.  District RRT  investigated  the  outbreak.  House  to  house survey done. Out of 08 serum samples collected 6 serum  samples  were  positive  for  Dengue  (IgM ELISA).All the 12 smears samples collected were negative     for     Malaria.     All     cases     treated symptomatically.    Source    reduction    activities undertaken. Health education given.","   Nay   Mohalla,   Khanapur,  Taluk  Kalburagi",17.3160837,76.8172001
123,1027,1027,26,2017,karanataka,Hassan,Hassan,16,0,29-06-2017 00:00,07-01-2017 00:00,"Cases  reported  from  Village  Buchana  Koppalu, PHC/CHC  Kallusadara  Halli,  Taluk  Arasikere. District RRT investigated the outbreak. House to house  survey  done.  Out  of  02  serum  samples collected  and  sent  to  Sentinel  surveillance  Lab (SSL), Hassan; 1 serum samples was positive for
Dengue    (IgM)    ELISA.    All    cases    treated symptomatically. Health education given.","  Buchana  Koppalu,   Kallusadara  Halli,  Taluk  Arasikere",13.479802,76.261079
124,1173,1173,34,2017,karanataka,Haveri,Haveri,14,0,22-08-2017 00:00,23-08-2017 00:00,"Cases   reported   from   Village   Hunivinodu,   SC Siddapanahatti,   PHC/CHC   Madadakere,   Taluk Hosadurga.    District     RRT     investigated     the outbreak. House to house survey done. 01 blood sample   found   positive   for   Dengue   at   DPL, Chitradurga.  All  cases  treated  symptomatically.
Source   reduction  activities   undertaken.   Health education given.","   Hunivinodu,   SC Siddapanahatti,      Madadakere,   Taluk Hosadurga",13.7983408,76.2824053
125,841,841,6,2017,karanataka,Kolar,Kolar,48,0,02-09-2017 00:00,02-09-2017 00:00,"Cases     reported     from     Village     Abbani, PHC/CHC Chamarhalli, Taluk Kolar. District RRT investigated the outbreak. House to house survey done. Out of 08 Blood samples tested at Sentinel  Surveillance  lab,  Kolar,  01  sample found  positive  to  IgM  Dengue  by  Elisa.  All
cases      treated      symptomatically.      Health education given.","     Abbani,  Chamarhalli, Taluk Kolar",13.0767494,78.2313101
126,1071,1071,29,2017,karanataka,Chickaballapura,Chickaballapura,21,0,07-08-2017 00:00,,"Cases   reported   from   Village   Kandakanahalli,   PHC/CHC Nayahalli,  Taluk  Chickaballapura.  District  RRT  investigated the  outbreak.  House  to  house  survey  done.  01  blood  sample collected  sent  to  Sentinel  Surveillance  Lab  was  positive  for Dengue   (IgM   ELISA).   All   cases  treated   symptomatically.
Health education given.","   Kandakanahalli,    Nayahalli,  Taluk  Chickaballapura",13.4353589,77.725598
127,1005,1005,25,2017,karanataka,Chikkaballapur,Chickaballapura,12,0,17-06-2017 00:00,23-06-2017 00:00,"Cases            reported             from            Village
Gundlanarsimhanhalli, PHC/CHC Y Hunaisehalli, Taluk Sidlaghatta.  District  RRT investigated  the outbreak.  House to house survey done. 01 blood sample  tested  at  SSL  Lab  found  positive  for Dengue     IgM     ELISA.     All     cases     treated symptomatically. Health education given."," Gundlanarsimhanhalli,  Y Hunaisehalli, Taluk Sidlaghatta",13.3928916,77.8642766
128,1242,1242,36,2017,karanataka,Chikkaballapur,Chickaballapura,95,0,31-07-2017 00:00,,"Cases reported  from 2  Villages of,  Taluk Sidlaghata.  Details are as follows:",Taluk Sidlaghata,13.3936652,77.8653126
129,822,822,3,2017,karanataka,Mandya,Mandya,65,0,01-09-2017 00:00,,"Cases  reported  from  Village  Mogarahalli  Manti,  PHC/CHC Palahalli,  Taluk  S.R.  Patna.  District  RRT  investigated  the outbreak.  House  to  house  survey  done.  Out  of  03  Blood samples tested, 1 found positive for Dengue On entomological survey, HI-16   CI - 8.9    BI � 16 were found. Source reduction
activities undertaken. Health education given.","  Mogarahalli  Manti,   Palahalli,  Taluk  S.R.  Patna",12.5274951,76.8905197
130,900,900,18,2017,karanataka,Mandya,Mandya,15,0,25-04-2017 00:00,,"Cases    reported    from    Village    Doddasomanahalli,    PHC Marenahalli,  Taluk  K.R.  Pet.  District  RRT  investigated  the outbreak.  House  to  house  survey  done.  05  serum  samples collected and tested at DSL Mandya, 02 samples were positive for  Chikungunya  and  01  sample  positive  for  Dengue  and
typhoid  culture.  All  cases  treated  symptomatically.  Health education given.","    Doddasomanahalli,    PHC Marenahalli,  Taluk  K.R.  Pet",13.0180015,77.1455294
131,938,938,21,2017,karanataka,Mandya,Mandya,60,0,05-01-2017 00:00,,"Cases  reported  from  Village/PHC/CHC  Sasalu,  Taluk  K.R. Pete.  District  RRT investigated  the outbreak.  House to house survey done. Out  of 09 blood samples collected sent to DSU, Mandya,  4  samples  were  positive  for  Dengue and  2  samples were positive for Chikungunya (IgM ELISA). All cases treated symptomatically.    Source    reduction    activities   undertaken.
Health education given.","/CHC  Sasalu,  Taluk  K.R. Pete",12.8000319,76.4488859
132,1008,1008,25,2017,karanataka,Mandya,Mandya,28,0,13-06-2017 00:00,,"Cases     reported     from     Village     Rampura,     PHC/CHC Valagerehalli,  Taluk  Maddur.  District  RRT  investigated  the outbreak. House to house survey done. 02 blood samples tested at DSU lab, Mandya, found Dengue positive. All cases treated symptomatically.   Source   reduction   activities   undertaken.
Health education given.","     Rampura,      Valagerehalli,  Taluk  Maddur",12.6192812,76.9902276
133,863,863,14,2017,karanataka,Raichur,Raichur,14,0,04-01-2017 00:00,04-04-2017 00:00,"Cases   reported   from   Village    A.   Bhogapur, PHC/CHC         Makapur, TalukLingasugur. DistrictRRT  investigated  the  outbreak.  House  to house   survey   done.   HI=21.3%,   BI=22%   and CI=4.1%. Majority of cases were in 20 to 40 years of age group. Out of 10 Samples tested; 2 found positive  for  Dengue  by  MAC  ELISA.  All  cases
treated symptomatically. Health education given.","    A.   Bhogapur,          Makapur,          TalukLingasugur",15.7866607,76.5032969
134,1268,1268,37,2017,karanataka,Shimoga,Shimoga,18,0,09-11-2017 00:00,13-09-2017 00:00,"Cases   reported   from   Village/Taluk   Shimoga.
District RRT investigated the outbreak. House to house survey done. Out of 17 Blood samples tested at  SSL  Shivamogga2  were  found  positive  for dengue and 2 for Chikungunya. All cases treated
symptomatically. Health education given.",/Taluk   Shimoga,13.9371393,75.5764656
135,899,899,18,2017,karanataka,Tumkur,Tumkur,13,0,27-04-2017 00:00,05-06-2017 00:00,"Cases reported from Village J Mallenahalli, PHC
Suguru,  Taluk  Tiptur.  District  RRT investigated the outbreak.  Out of 11 serum samples collected and   tested   at   DSL,   Tumkur   2   samples   were positive for Dengue IgM ELISA. House to house survey  done.  All  cases  treated  symptomatically. Health education given."," J Mallenahalli, PHC Suguru,  Taluk  Tiptur",13.3399947,77.1000174
136,901,901,18,2017,karanataka,Tumkur,Tumkur,13,0,27-04-2017 00:00,05-06-2017 00:00,"Cases reported from Village J Mallenahalli, PHC
Suguru,  Taluk  Tiptur.  District  RRT investigated the outbreak.  Out of 11 serum samples collected and   tested   at   DSL,   Tumkur   2   samples   were positive for Dengue IgM ELISA. House to house survey  done.  All  cases  treated  symptomatically. Health education given."," J Mallenahalli, PHC
Suguru,  Taluk  Tiptur",13.1804993,76.5112471
137,1028,1028,26,2017,karanataka,Tumkur,Tumkur,30,0,23-06-2017 00:00,30-06-2017 00:00,"Cases  reported  from  Village  Malladevanahalli, PHC/CHC     Mayasandra,     Taluk     Turuvekere. District RRT investigated the outbreak. House to house   survey   done.   Out   of   02   blood   serum samples collected and tested at SSL,  Tumkur; 02 serum  samples  were  positive  for  Chikungunya IgM ELISA & 01 serum ample was positive for Dengue     IgM     ELISA.     All     cases     treated
symptomatically. Health education given.","  Malladevanahalli,   Mayasandra,Taluk Turuvekere",13.1438031,76.7908287
138,1029,1029,26,2017,karanataka,Tumkur,Tumkur,23,0,14-06-2017 00:00,,"Cases    reported    from    Village    Navilakurike,    PHC/CHC Bukapatagere, Taluk Koratagere. District RRT investigated the outbreak.  House  to  house  survey  done.  02  blood  samples collected  were  positive  for  Dengue  IgM  ELISA.  All  cases treated      symptomatically.      Source      reduction      activities
undertaken. Health education given.","  Navilakurike,  Bukapatagere, Taluk Koratagere",13.519344,77.2346779
139,1206,1206,35,2017,karanataka,Tumkur,Tumkur,15,0,23-08-2017 00:00,,"Cases  reported  from  Village  Rangapura  Gollarahatti.  PHC Badavanahalli,  Taluk    Madhugiri.  District  RRT  investigated the  outbreak.  House  to  house  survey  done.  Out  of  02  serum samples  tested  at  SSL  Tumkur,  1  found  positive  for  Dengue and  Chikungunya.  All  cases  treated  symptomatically.  Source
reduction activities undertaken. Health education given.","  Rangapura  Gollarahatti.  PHC Badavanahalli,  Taluk    Madhugiri",13.661285,77.21575
